{
  "schema": 1,
  "id": "ring",
  "name": "Orbital ring",
  "dock_radius": 150.0,
  "crane": false,
  "decks": [
    {
      "name": "Concourse",
      "grid": [
        "                                    ",
        " .  .  .  .  .  .  .  .  .  .  .  . ",
        "                                    ",
        "               #=#                  ",
        " .  .  .  .  . #q# .  .  .  .  .  . ",
        "               # #                  ",
        "   ############   ###############   ",
        " . #            s               # . ",
        "   #                            #   ",
        "   #                            #   ",
        " . #                            # . ",
        "   #############b################   ",
        "                                    ",
        " .  .  .  .  .  .  .  .  .  .  .  . ",
        "                                    "
      ]
    }
  ]
}
