{
  "schema": 1,
  "id": "highport",
  "name": "Highport",
  "dock_radius": 150.0,
  "crane": true,
  "decks": [
    {
      "name": "Concourse",
      "grid": [
        "                                                                                                                                                                                                                                                                                          ",
        " .  .  .  .  .  .  .  .  .  .  .  .  .  .  .  .  .  .  .  .  .  .  .  .  .  .  .  .  .  .  .  .  .  .  .  .  .  .  .  .  .  .  .  .  .  .  .  .  .  .  .  .  .  .  .  .  .  .  .  .  .  .  .  .  .  .  .  .  .  .  .  .  .  .  .  .  .  .  .  .  .  .  .  .  .  .  .  .  .  .  .  .  .  . ",
        "                                                                                                                                                                                                                                                                                          ",
        "                                                                  #=#                                                                                             #=#                                                                                             #=#                     ",
        " .  .  .  .  .  .  .  .  .  .  .  .  .  .  .  .  .  .  .  .  .  . #q# .  .  .  .  .  .  .  .  .  .  .  .  .  .  .  .  .  .  .  .  .  .  .  .  .  .  .  .  .  .  . #q# .  .  .  .  .  .  .  .  .  .  .  .  .  .  .  .  .  .  .  .  .  .  .  .  .  .  .  .  .  .  . #q# .  .  .  .  .  .  . ",
        "                                                                  # #                                                                                             # #                                                                                             # #                     ",
        "   ###############################################################   #############################################################################################   #############################################################################################   ##################   ",
        " . #                                                                                       f  f  f  f        l  l  l                                                                                                                                                                  # . ",
        "   #                                                                                                                                                                                                                                                                                  #   ",
        "   #                           b                                                                                                                                                     b                                                                                                #   ",
        " . #                                                                                                                                          s                                                                                                                                       # . ",
        "   #                                                                                                                                                                                                                                                                                  #   ",
        "   #                                                                                                                                                                                                                                                                                  #   ",
        " . #                                                                                                                                                                                                                                                                                  # . ",
        "   ####################################################################################################################################################################################################################################################################################   ",
        "                                                                                                                                                                                                                                                                                          ",
        " .  .  .  .  .  .  .  .  .  .  .  .  .  .  .  .  .  .  .  .  .  .  .  .  .  .  .  .  .  .  .  .  .  .  .  .  .  .  .  .  .  .  .  .  .  .  .  .  .  .  .  .  .  .  .  .  .  .  .  .  .  .  .  .  .  .  .  .  .  .  .  .  .  .  .  .  .  .  .  .  .  .  .  .  .  .  .  .  .  .  .  .  .  . ",
        "                                                                                                                                                                                                                                                                                          "
      ]
    }
  ]
}
